,Contexto,Documento,Pregunta,Respuesta,Modelo,Indice original
112,"e) Primacía del “aquí y ahora”: en esos momentos de gran dolor no podemos tomar una actitud terapéutica rígida, como sería intentar descifrar el origen del sufrimiento, como lo hacemos cuando entrevistamos a una persona en nuestro despacho, tras pedir hora. Por esto nuestra preocupación se debe centrar en las necesidades tanto físicas como psíquicas de ese instante: ofrecer una tila o un café, buscar un analgésico para el dolor de cabeza o posibilitar la exteriorización de los sentimientos más negativos: rabia, culpa, etc. Todo ello en un clima de tolerancia máxima, siempre y cuando no exista ningún peligro para algunas de las víctimas. Sería un error intentar “psicologizar” esa situación buscando una explicación del sufrimiento o analizando el tipo de vinculación entre los familiares o su resolución del Edipo, por ejemplo. El sufrimiento está ahí y el ayudador está para contenerlo y en todo caso intentar canalizarlo, para que las consecuencias sean las mínimas. No olvidemos que las ví",2013 INTERVENCION-EN-CRISIS-ROCAMORA.pdf,¿Qué debería hacer la familia del paciente terminal si están considerando el suicidio asistido?,"Si la familia del paciente terminal está considerando el suicidio asistido, es importante recordar que el suicidio asistido está prohibido en muchos países y que la familia debe asegurarse de que el paciente cumple con todos los requisitos legales para el procedimiento. Además, la familia debe asegurarse de que el paciente comprende los riesgos y beneficios del suicidio asistido y que su voluntad para participar en el procedimiento es voluntaria y no forzada.",bertin-project/bertin-gpt-j-6B-alpaca,112
113,"¿Por qué se produce este sentimiento? Una posible explicación es la siguiente: uno de los mitos que existen sobre el suicidio es que solamente se suicidan los locos, y dado que la locura es un estigma que produce rechazo, el superviviente de un suicidio se puede sentir avergonzado por esa acción (Worden, 1997). Otra explicación, según Pérez Barrero y Mosquera (2006), es que los supervivientes manifiestan un pensamiento distorsionado, el cual se presenta por la necesidad de ver la conducta de la víctima, no como un suicidio sino como una muerte accidental, creándose un patrón de comunicación distorsionada en las familias. La familia crea así un mito respecto a lo que realmente le ocurrió a la víctima, y si alguien cuestiona la muerte llamándola por su nombre real, produce un gran enojo y rechazo de los demás, aquellos que necesitan verla como una muerte accidental o natural. Así, es frecuente que los miembros de la familia oculten la causa de la muerte y sepan quién sabe y quién no, la ",2013 INTERVENCION-EN-CRISIS-ROCAMORA.pdf,¿Cómo podemos desestigmatizar el suicidio?,Hablando abiertamente sobre él y creando conciencia.,bertin-project/bertin-gpt-j-6B-alpaca,113
114,"PREVENCIÓN DE LA CONDUCTA SUICIDA En un sentido estricto, el término prevención del suicidio se refiere a toda actividad dirigida a rescatar a aquellos que han hecho un intento o que abiertamente han declarado hacerlo (Norman y Farberow, 1968). En sentido amplio la prevención se puede entender desde la promoción de la salud a la rehabilitación psíquica tras un intento de suicidio (Huguette Bergeron, 1985) La prevención suicidológica va a depender, fundamentalmente, de dos factores (OMS, 1969): la rapidez con que se identifique a las personas con alto riesgo y elegir un tratamiento adecuado. Ambos cometidos se pueden realizar desde un Centro de Intervención en Crisis, pues están en contacto con una población de alto riesgo (desesperación, soledad, depresión etc.), lo cual posibilita la realización de un diagnóstico precoz y la instauración de medidas terapéuticas eficaces. Se pueden señalar cuatro secuencias en la prevención de las conductas autodestructivas (Rojas, 1984; Alonso Fernánd",2013 INTERVENCION-EN-CRISIS-ROCAMORA.pdf,¿Cuáles son los dos factores que posibilitan la realización de un diagnóstico precoz y la instauración de medidas terapéuticas eficaces?,"Los dos factores que posibilitan un diagnóstico precoz y la instauración de medidas terapéuticas eficaces son la rapidez de reconocimiento de las personas en riesgo y la disponibilidad de recursos adecuados. En el caso de la prevención del suicidio, la rapidez de reconocimiento de las personas en riesgo se puede realizar a través de la identificación de los factores de riesgo y la detección temprana de las señales de advertencia. Esto se puede lograr a través de la formación y concienciación del personal de salud, así como a través de la implementación de sistemas de detección temprana. La disponibilidad de recursos adecuados para el tratam",bertin-project/bertin-gpt-j-6B-alpaca,114
115,"Valorar la gravedad En estas circunstancias debemos tener en cuenta los siguientes aspectos (Martínez, 2007): • Dimensión de la tentativa: valorar el riego real de muerte y sus posibilidades. • Estado psicopatológico: el riesgo de muerte es mayor si el nivel de desesperanza y depresión es alto, existe alteración de la conciencia o el juicio de realidad está alterado (en los pacientes psicóticos). • Intencionalidad: valorar si la decisión de morir es firme o lo que se pretende es un cambio de actitud en otra persona, pareja, padres, etc.). • Intentos previos: es mayor riesgo si ya se ha intentado en otras ocasiones. • Valorar el apoyo familiar y social: sería muy conveniente conocer si existe una figura representativa en la vida del presuicida. 4. Actuar Tras la neutralización del acto suicida es conveniente una valoración posterior por el psicólogo o psiquiatra y por lo tanto es imprescindible la remisión a un centro hospitalario para su exploración definitiva y determinar, si procede ",2013 INTERVENCION-EN-CRISIS-ROCAMORA.pdf,¿Qué factores deben considerarse al valorar la gravedad de un acto suicida?,"Al valorar la gravedad de un acto suicida, se deben tener en cuenta varios factores. En primer lugar, se debe considerar la intención del individuo y la seriedad de su deseo de terminar con su propia vida. En segundo lugar, se debe considerar el estado psicológico del individuo, ya que el riesgo de suicidio aumenta con la desesperanza y la depresión. En tercer lugar, se debe considerar la disponibilidad de medios para llevar a cabo el acto suicida. Por último, se debe considerar el apoyo social y familiar del individuo, ya que esto puede ayudar a reducir el riesgo de suicidio.",bertin-project/bertin-gpt-j-6B-alpaca,115
116,"Nunca nuestra acción de ayuda hacia otra persona es inocua. Aquí radica la grandeza, y también el riesgo, de la acción terapéutica. Toda persona que pide ayuda se encuentra en una encrucijada: desea cambiar (conseguir un gradiente más de autoestima o de libertad), pero, al mismo tiempo se siente inclinada a permanecer encadenada a sus angustias y temores. Paradójicamente los dos aspectos son necesarios para iniciar una relación terapéutica. Si no se produce la primera (el deseo de cambiar) no se pedirá ayuda; pero si no se da la segunda condición (la tendencia a permanecer atado a su angustia) no sería necesaria la psicoterapia (Singer, 1969). Pero al mismo tiempo, toda relación terapéutica también deja su impronta en el consejero. Éste nunca consigue una total asepsia ante la persona que ayuda. El contacto con la patología psíquica puede despertar viejos fantasmas (el miedo a la muerte, el rechazo de la sexualidad, el odio hacia la madre, etc.) que condicionará la propia relación tera",2013 INTERVENCION-EN-CRISIS-ROCAMORA.pdf,¿Cuál es el riesgo de la acción terapéutica?,"El riesgo de la acción terapéutica es que puede llevar a una relación demasiado íntima entre el consejero y el cliente, lo que puede llevar a una dependencia o a una falsa sensación de seguridad. También puede llevar a una falta de distancia y objetividad, lo que puede impedir que el consejero proporcione una ayuda efectiva.",bertin-project/bertin-gpt-j-6B-alpaca,116
117,"Criterio científico: Los terapeutas deben tomar todas las precauciones posibles al confrontar a una persona que habla acerca de ideas, planes o intenciones suicidas. Todas las amenazas de daño a sí mismo se deben tomar en serio. Mito 5: El suicidio es siempre impulsivo y ocurre sin advertencia. Criterio científico: El suicidio puede parecer impulsivo, pero puede haber sido considerado durante algún tiempo. Muchos suicidas dan algún tipo de indicación verbal o conductual acerca de sus intenciones de hacerse daño. Mito 6: Los suicidas de verdad quieren morir o están resueltos a matarse. Criterio científico: la mayoría de las personas con ideas suicidas comunican sus pensamientos a por lo menos una persona, o llaman a una línea telefónica de crisis o al médico, lo cual es prueba de ambivalencia, no de intención irrevocable de matarse. Mito 7: Cuando un individuo da señales de mejoría o sobrevive a un intento de suicidio, está fuera de peligro. Criterio científico: En realidad, uno de los ",2013 INTERVENCION-EN-CRISIS-ROCAMORA.pdf,¿Cuál es la tasa de mortalidad entre las personas que se suicidaron en comparación con aquellas que intentaron hacerlo?,La tasa de mortalidad entre las personas que se suicidaron es mucho más alta que entre aquellas que intentaron hacerlo.,bertin-project/bertin-gpt-j-6B-alpaca,117
118,"De ahí, la importancia de este período post-crisis, pues nos va mostrar si la crisis, en definitiva, ha sido positiva o negativa. Es decir, si la persona en crisis ha crecido psicológicamente, se ha mantenido en su nivel de salud mental inicial o, desgraciadamente, se ha producido un retroceso en su actitud psicológica. Incluso la crisis y la salida de la misma puede repercutir en el grupo familiar y social, positiva o negativamente, reforzando la coherencia de la unidad familiar o social, o bien, favoreciendo la dispersión y la ruptura de las vinculaciones familiares y sociales. 4. Características de la crisis Por lo anteriormente apuntado, podemos afirmar que la crisis no se explica por sí misma sino que necesita la perspectiva del pasado para comprenderla. Toda crisis tiene un antes y un después. Es más: toda crisis es como un parto: debe salir otra cosa diferente a la anterior, de lo contrario se produciría la muerte, es decir, la enfermedad mental. Según Fiorini (1999) toda crisis",2013 INTERVENCION-EN-CRISIS-ROCAMORA.pdf,¿Cuál es la importancia de este período post-crisis?,"La importancia de este período post-crisis es que nos va mostrar si la crisis, en definitiva, ha sido positiva o negativa. Es decir, si la persona en crisis ha crecido psicológicamente, se ha mantenido en su nivel de salud mental inicial o, desgraciadamente, se ha producido un retroceso en su actitud psicológica. Incluso la crisis y la salida de la misma puede repercutir en el grupo familiar y social, positiva o negativamente, reforzando la coherencia de la unidad familiar o social, o bien, favoreciendo la dispersión y la ruptura de las vinculaciones familiares y sociales.",bertin-project/bertin-gpt-j-6B-alpaca,118
119,"• Es necesario procurar que el familiar acuda a un profesional de la psicología y en este caso, podemos insistir en ello, no tanto por sus ideas de muerte, sino sobre todo por el sufrimiento que esto produce: angustia, insomnio, tristeza, etc. 5. El acto suicida está en curso Acudo como psiquiatra del Servicio de Emergencia, tras la llamada de un transeúnte que dice haber visto a una persona cerca del acantilado. Es el mes de enero. Son las cinco de la tarde, hace frío y el cielo amenaza con lluvia. Hemos tenido que dejar la ambulancia a unos doscientos metros por lo abrupto del terreno. Me acerco despacio sin perder el contacto visual con la persona que se encuentra de pie junto al acantilado y mirando fijamente hacia el mar donde las olas rompen de forma estrepitosa. Terapeuta: Hola, soy Alejandro, psiquiatra del centro de emergencias (me sitúo a unos diez metros y mantengo constantemente la mirada puesta en la víctima) Victima: (no se mueve y sigue mirando al fondo del mar) Terapeut",2013 INTERVENCION-EN-CRISIS-ROCAMORA.pdf,¿Qué tipo de profesional de la salud mental debo consultar si estoy luchando con pensamientos suicidas?, Un psiquiatra o psicólogo con experiencia en el tratamiento de problemas de salud mental.,bertin-project/bertin-gpt-j-6B-alpaca,119
120,"Por esto, es necesario explorar la vivencia suicida pero sin provocar un repliegue sobre sí mismo, que dificultaría la sana elaboración de esos deseos malditos. b) Evitar los eufemismos: es imprescindible que pongamos en nuestra boca la palabra suicidio para indicar claramente, que aunque el tema es doloroso no nos apartamos de él. Es una manera de comunicar al otro que estamos en disposición de soportar su angustia, incluso el de la propia autodestructividad. c) Favorecer una transferencia positiva: es imprescindible que en este tipo de entrevistas consigamos conectar con el consultante aceptando (aunque no compartiendo) sus vivencias suicidas y procurando favorecer una transferencia positiva, que posibilite una adecuada ayuda terapéutica. Varias son las acciones que podemos realizar para conseguir este fin: • disponibilidad: debemos transmitir al consultante que estamos dispuestos a atenderle en cualquier momento que lo necesite y que no es necesario que cumpla todos los requisitos a",2013 INTERVENCION-EN-CRISIS-ROCAMORA.pdf,¿Qué medidas se pueden tomar para explorar la vivencia suicida sin provocar un repliegue sobre sí mismo?,"Es importante explorar la vivencia suicida sin provocar un repliegue sobre sí mismo, ya que esto dificultaría la sana elaboración de los deseos malditos. Algunas medidas que se pueden tomar incluyen escuchar activamente, hacer preguntas de seguimiento relevantes, mantener una actitud de empatía y comprensión, y evitar hacer suposiciones. Además, es importante asegurarse de que el entorno del consultante es seguro y de que no hay ningún peligro presente.",bertin-project/bertin-gpt-j-6B-alpaca,120
121,"El suicidio de las personas que padecen una esquizofrenia se caracteriza por su impulsividad (por esto es difícil de establecer medidas de contención) y porque los medios que utiliza son de gran letalidad: defenestración, disparo en la cabeza, arrojamiento al tren, etc. Estas personas pueden llegar al suicidio por dos vías: como producto de su propia psicopatología (“las voces me dicen que me tire por la ventana” o también la gran angustia psicótica puede llevar al suicidio como forma de escapar de esa situación) o bien al tomar conciencia de las consecuencias nefastas de la propia enfermedad: incapacidad para formar una familia, no poder trabajar, etc. Estrategias terapéuticas Comprensión y disponibilidad: la persona que padece una esquizofrenia necesita ser aceptada tal como es asumiendo sus deficiencias e incluso sus conductas extrañas y no sentirse rechazada ni sancionada por su forma de vivir. Por otra parte, dado lo imprevisible de las conductas suicidas en estos pacientes, el te",2013 INTERVENCION-EN-CRISIS-ROCAMORA.pdf,¿Cuáles son las estrategias terapéuticas para abordar el suicidio en pacientes con esquizofrenia?,"Las estrategias terapéuticas para abordar el suicidio en pacientes con esquizofrenia incluyen comprensión y disponibilidad, así como la implementación de estrategias de prevención de suicidio. La comprensión implica asumir que la persona con esquizofrenia está experimentando una gran angustia psicótica y que su conducta suicida es un intento desesperado de huir de ella. La disponibilidad implica estar atento a las señales de advertencia de suicidio y brindar apoyo y contención a la persona con esquizofrenia en todo momento. Las estrategias de prevención de suicidio implican establecer medidas de contención y proporcionar acceso a recursos de apoyo externos.",bertin-project/bertin-gpt-j-6B-alpaca,121
122,"La AC podría ayudar a millones de personas que luchan contra la depresión y contra la inercia, que es una parte muy importante de este trastorno debilitante. Los autores establecen claras conexiones entre la AC y los modernos tratamientos para la depresión. El libro está escrito con un lenguaje sencillo e incluye ejemplos realistas de algunos casos. Será una obra de referencia importante para los clínicos que quieran perfeccionar su aproximación a los problemas de sus clientes con depresión, y será un texto excelente para los cursos de graduados sobre la terapia conductual o sobre los tratamientos para la depresión con base empírica.- Dr. Robert J. DeRubeis Departamento de Psicología, Universidad de Pennsylvania Conciso y bien escrito, este es actualmente el libro más asequible y útil desde el punto de vista clínico sobre la AC para la depresión. Trata sobre los pilares teóricos de la AC, sobre las pruebas que avalan su eficacia, y sobre los principios fundamentales de una presentación",2013 INTERVENCION-EN-CRISIS-ROCAMORA.pdf,¿Cuál es la inercia en el trastorno depresivo?,"La inercia en el trastorno depresivo se refiere a la falta de interés en actividades que antes disfrutaba, así como a sentirse inútil y sin esperanza.",bertin-project/bertin-gpt-j-6B-alpaca,122
123,"Las personas suicidas mantienen una perspectiva pesimista sobre su futuro, su entorno y sobre ellos mismos, así como un estilo atribucional depresivo (que establece una causa interna, estable y global sobre los eventos negativos) (Beck, Rush, Shaw y Emery, 1979). Este estilo cognitivo, asociado a un proceso emocional y comportamental disfuncional, puede reducir la percepción de soluciones disponibles y conducir a un estado de desesperanza, elevando así la probabilidad de suicidio. Concretamente, una de las hipótesis más consensuadas para explicar la ideación y la propia conducta suicida, considera necesaria la aparición de un suceso estresante generador de ciertas emociones (especialmente de frustración o rechazo), el deseo de escapar de la situación o de comunicar a otros sus problemas, junto con la valoración de que tal opción no es posible y de la falta de recursos para aliviar tal crisis (por ejemplo, apoyo social). Esta secuencia de ideas, junto a la disponibilidad de medios para ",2013 UAM  Protocolo para la detección y manejo inicial de la idea suicidia .pdf,¿Cuál es la causa principal de que las personas suicidas tengan una perspectiva pesimista sobre su futuro?,"La causa principal de que las personas suicidas tengan una perspectiva pesimista sobre su futuro es su estilo atribucional depresivo, que establece una causa interna, estable y global sobre los eventos negativos.",bertin-project/bertin-gpt-j-6B-alpaca,123
124,"Se presentan en las siguientes líneas las principales fases y ejemplos de preguntas del terapeuta que se deben realizar en relación a los pensamientos suicidas o los intentos suicidas cuando sospechamos o detectamos riesgo de suicidio: Fase 1 Lo más adecuado es iniciar las preguntas a partir de una situación específica que el sujeto haya señalado como especialmente conflictiva o preocupante.  ¿Cómo piensa resolver su situación/ o la situación que me ha descrito?, ¿ha pensado en suicidarse?  ¿Alguna vez ha pensado en hacerse daño?(si no ha comentado nada relacionado con pensamientos de suicidio)  Me ha comentado que no duerme mucho, cuando está sin poder dormir ¿en qué piensa?(si se siente más cómodo tratando el tema indirectamente) Conviene en cualquier caso indagar sobre la frecuencia e intensidad de los pensamientos así como interferencia en la vida del paciente.  ¿Piensa todos los días en quitarse de en medio? (se sugiere una frecuencia elevada para evitar en lo posible que se s",2013 UAM  Protocolo para la detección y manejo inicial de la idea suicidia .pdf,¿Qué tipo de preguntas debería hacerle a un paciente que está considerando el suicidio?,"Es importante estar atento a cualquier signo de advertencia de suicidio, como hablar sobre la muerte o el suicidio, cambios en los hábitos alimenticios o del sueño, o cambios en los hábitos de gasto. También es importante estar atento a las señales de advertencia no verbales, como cambios en la ropa, el aseo o la rutina. Si alguno de estos comportamientos está presente, es importante hablar con el paciente y escuchar atentamente, y luego tomar las medidas necesarias para ayudar al paciente.",bertin-project/bertin-gpt-j-6B-alpaca,124
125,"Adaptación del modelo de conducta suicida (Williams y Pollock, 2001; citado en Palmer, 2007) Estrés: especialmente derrota o rechazo Escape potencial Sentimientos de Indefensión Apoyo social, no percibe posibilidad de ayuda Interpretación de la persona de la situación: ¿En qué medida es estresante? ¿En qué medida puedo escapar? ¿Con cuánto apoyo cuento? Afectado por sesgos en el procesamiento de información y déficits memorísticos 24 PROTOCOLO PARA LA DETECCIÓN Y MANEJO INICIAL DE LA IDEACIÓN SUICIDA 8.3. Mitos más comunes relacionados con el suicidio  El que expresa su deseo de acabar con su vida no lo hace. Este es uno de los mitos más repetidos, sin embargo, las investigaciones sugieren que de cada diez personas que se suicidan, nueve verbalizaron claramente sus propósitos y la otra dejó entrever sus intenciones de acabar con su vida. Por lo tanto, estas señales nunca pueden ser consideradas a priori como un chantaje o manipulación de la persona para la obtención de un fin determin",2013 UAM  Protocolo para la detección y manejo inicial de la idea suicidia .pdf,¿Es el suicidio una salida fácil?,"No, el suicidio no es una salida fácil. Es una decisión difícil que debe ser abordada con cuidado y comprensión.",bertin-project/bertin-gpt-j-6B-alpaca,125
126,", la severidad, la irreversibilidad nos señalarán la gravedad de la ideación. Se ha de explorar la accesibilidad al método e indagar si algún familiar o conocido lo ha empleado anteriormente. • ¿Cómo ha pensado en suicidarse? lo voy a hacer”, “de cualquier Es importante diferenciar la especificidad de la ideación. Por ejemplo, una ideación podría expresarse desde una forma menos específica como “no sé cómo, forma, ahorcándome, quemándome, pero pegándome un balazo” a una forma más específica sobre el método como “lo voy a hacer porque no merece la pena vivir, mañana me voy a asfixiar tragándome el humo del coche en el garaje cuando no haya nadie en casa”. La circunstancia o día concreto. Por ejemplo puede que espere a quedarse solo, postergue el momento para arreglar determinadas cuestiones como testamento, notas de despedida, etc.  ¿Cuándo ha pensado en suicidarse? El lugar. Normalmente suelen ser lugares comunes y frecuentados por el sujeto (su casa, escuela, casas de familiares o am",2013 UAM  Protocolo para la detección y manejo inicial de la idea suicidia .pdf,¿Qué le diría a alguien que está pensando en suicidarse?," Que aunque es una decisión difícil, hay ayuda disponible y que hay esperanza",bertin-project/bertin-gpt-j-6B-alpaca,126
127,"En la mejora del estado de ánimo relacionado con ideación suicida, tiene un papel relevante la creación de un programa de activación conductual en el que mediante registros se compruebe la planificación y puesta en marcha de actividades, preferiblemente con personas significativas. En la mayor parte de los casos, se deberá recordar que lo importante es que las realice (no lo bien que lo haga) pese a que no le apetezca en ese momento y especificar cuándo, cómo y dónde lo va a realizar. Esta estrategia servirá para aumentar frecuencia y duración de las experiencias positivas (refuerzos), y más adelante también en la mejora de la autoeficacia y competencia personal. Reducción de la desesperanza y falta de expectativas positivas hasta alcanzar niveles normales. Para poder alcanzar este objetivo, pueden ser útiles técnicas cognitivas como identificación de razones para vivir, la cual requiere identificar los recuerdos o aspectos que den o hayan dado sentido a su vida, razones de vivir que t",2013 UAM  Protocolo para la detección y manejo inicial de la idea suicidia .pdf,¿Qué tipo de actividades se deben incluir en el programa de activación conductual?,"El programa de activación conductual debe incluir actividades como pasear al perro, hacer jardinería o ir al supermercado. Cualquier actividad que sea agradable y que aumente el sentido de conexión social de la persona debe ser incluida.",bertin-project/bertin-gpt-j-6B-alpaca,127
