,Contexto,Documento,Pregunta,Respuesta,Modelo,Indice original
0,"La Constitución Española20 reconoce y protege “el derecho a comunicar o recibir libremente información veraz. La Ley regulará el derecho a la cláusula de conciencia y al secreto profesional en el ejercicio de las estas libertades”. Igualmente dispone que “la ley regulará los casos en que, por razón de parentesco o de secreto profesional, no se estará obligado a declarar sobre hechos presuntamente delictivos”21. Aunque el secreto profesional aparece mencionado en los artículos transcritos referidos a los derechos de comunicación, información y defensa, está también directamente relacionado con la protección de otros derechos fundamentales. Así se constituye en una figura jurídica compleja que es una pieza clave en la salvaguarda de distintos derechos fundamentales. La intimidad como derecho de la personalidad constituye un fundamento jurídico genérico o básico de la institución del secreto profesional. Directamente relacionado con la intimidad está lo que se conoce como esfera de la int",000ProtocoloPrevencionSuicidio3 Navarra.pdf,¿Qué medidas puede tomar el médico para ayudar a prevenir el suicidio?," El médico puede proporcionar orientación y apoyo a un paciente en riesgo de suicidio, como ayudarles a desarrollar un plan para la gestión de sus problemas, proporcionarles acceso a recursos de salud mental y ayudarles a identificar y manejar cualquier condición médica subyacente que pueda estar contribuyendo a su riesgo de suicidio.",bertin-project/bertin-gpt-j-6B-alpaca,0
1,"que en última instancia, en su articulación, producen las series estadísticas. 3 Schmidtke, 1991 en Rodao JM 1997 4 Sarró y de la Cruz, 1991, en Rodao JM, 1997 5 Gutiérrez 1995 en Rodao J:M 1997). 6 Gutierrez García JM, 1996 7 Gutiérrez, 1995 3 1 a n i g á P 4 LAS CONDUCTAS SUICIDAS EN NAVARRA. Las distorsiones de la realidad producidas por las estadísticas de suicidio derivarían, por lo tanto, de cuatro fuentes diferentes pero interrelacionadas: (cid:157) (cid:157) (cid:157) (cid:157) El veredicto médico-forense-judicial. El grado de aceptación-rechazo social del suicidio. Los métodos de registro. Las dificultades diagnósticas. A pesar de estas dificultades, existen datos sobre los que hay acuerdo entre la mayoría de estudiosos y a ellos nos remitimos en este capítulo. La Organización Mundial de la Salud estima que en torno a un millón de personas fallecen en el mundo anualmente a causa de suicidio, lo que supone una muerte cada 40 segundos. Habría que multiplicar hasta por 20 estas c",000ProtocoloPrevencionSuicidio3 Navarra.pdf,"¿Cuál es la tasa de suicidio por cada 100,000 personas en España?"," La tasa de suicidio por cada 100,000 personas en España es de 10.3 por cada 100,000 personas.",bertin-project/bertin-gpt-j-6B-alpaca,1
2,"La elaboración de la Guía de Práctica Clínica de Prevención y Tratamiento de la Conducta Suicida del Ministerio de Sanidad contribuye a reducir la variabilidad de la práctica clínica en el manejo de la conducta suicida, ayuda a la toma de decisiones por parte de los profesionales sanitarios y pretende la mejora en la salud y calidad de vida de la población. Mejora la información de pacientes, familiares y ciudadanía de modo que logre reducir el estigma asociado a este problema de salud. La recomendación general del Sistema Nacional de Salud consiste en que las intervenciones se basen en las características específicas de la población en la que se pretende prevenir la conducta suicida, por lo que si esos datos no están disponibles, el primer paso sería realizar estudios exploratorios en cuyos resultados puedan basarse posteriormente las indicaciones23. La prevención del suicidio en la población general, donde el suicidio es un fenómeno raro, es muy compleja. Los esfuerzos deben centrars",000ProtocoloPrevencionSuicidio3 Navarra.pdf,¿Cuál es el propósito de la Guía de Práctica Clínica de Prevención y Tratamiento de la Conducta Suicida del Ministerio de Sanidad?,"El propósito de la Guía de Práctica Clínica de Prevención y Tratamiento de la Conducta Suicida del Ministerio de Sanidad es reducir la variabilidad de la práctica clínica en el manejo de la conducta suicida, ayudar a la toma de decisiones por parte de los profesionales sanitarios y mejorar la salud y calidad de vida de la población.",bertin-project/bertin-gpt-j-6B-alpaca,2
3,"El médico de AP es en muchos casos el primer profesional que contacta con una persona con ideación suicida. Ninguna estrategia va a resultar útil sino se ha detectado o evaluado previamente el grado de intencionalidad suicida. Según la última recomendación de U.S. Preventive Services Task Force de mayo de 2014 sobre riesgo de suicidio en adolescentes, adultos y mayores en Atención primaria, no hay evidencias para potenciar el screening de riesgo de suicidio a población general en primaria. Sí estaría indicado en aquellas personas con síntomas o antecedentes de trastorno mental o intentos de suicidio previos. Se sugiere que la reducción de la tasa de suicidio solo podrá lograrse si se mejora la capacidad de AP en reconocer y tratar los trastornos mentales. Así, la principal medida preventiva sería capacitar a los profesionales en el abordaje diagnóstico y psicoterapéutico26. 25 Luoma JB, Martin CE, Pearson JL. Contact with mental health and primary care providers before suicide: a revie",000ProtocoloPrevencionSuicidio3 Navarra.pdf,¿Cuál es la principal medida preventiva para reducir la tasa de suicidio?,La principal medida preventiva para reducir la tasa de suicidio es mejorar la capacidad de los profesionales de Atención primaria en el abordaje diagnóstico y psicoterapéutico de los trastornos mentales.,bertin-project/bertin-gpt-j-6B-alpaca,3
4,"Cómo dialogar sobre el tema. Sentir enfado en el paciente. Sentir rechazo hacia el paciente. Falta de confianza por parte del paciente. Falta de tiempo. Obtener colaboración de la familia. Ajuste inadecuado. Falta de estructuras sociales de ayuda. Trabajar con la familia. Ausencia de un equipo multidisciplinar. Aportación de un soporte a la familia. Como resumen, el estudio concluye que entre los grupos de la muestra, existen diferencias significativas en cuanto a las necesidades, y son los médicos generalistas (médicos de familia) quienes más inciden en las dificultades técnicas y consideran que la formación en este campo es fundamental. Aunque este estudio se basa en una muestra de profesionales sanitarios, no son éstos los únicos que se enfrentan en su trabajo a la posibilidad y efectos de las conductas suicidas en las personas a las que atienden. Educadores, trabajadores sociales, policías, profesionales de los servicios de urgencias, por citar algunos, deben estar preparados para ",000ProtocoloPrevencionSuicidio3 Navarra.pdf,¿Cuáles son las necesidades de los médicos generalistas (médicos de familia) en cuanto a la formación en la prevención del suicidio?,"Los médicos generalistas (médicos de familia) necesitan formación en la prevención del suicidio para poder reconocer los signos y síntomas de las conductas suicidas, así como para poder proporcionar la ayuda necesaria a sus pacientes en riesgo de suicidio.",bertin-project/bertin-gpt-j-6B-alpaca,4
5,"La ideación suicida y la presencia de planificación aumentan considerablemente el riesgo de suicidio. Pero los intentos previos son el predictor más fuerte de riesgo suicida. Durante los seis primeros meses e incluso durante el primer año después del intento, el riesgo aumenta considerablemente (especialmente en el caso de los ancianos). 1 2 a n i g á P 5 FACTORES ASOCIADOS CON LA CONDUCTA SUICIDA. EEddaadd. Los momentos con más riesgo de intentos y de suicidios consumados a lo largo de la vida son la adolescencia y la edad avanzada. Dentro de estos grupos, los ancianos usan métodos más letales y presentan tasas de suicidio más elevadas. SSeexxoo. En líneas generales, los hombres presentan mayores tasas de suicidios consumados y utilizan métodos más letales, mientras que las mujeres presentan mayor número de intentos. Existen, de todos modos, diferencias culturales en cuanto al influjo de este factor (en China e India el suicidio es más frecuente en mujeres). FFaaccttoorreess ggeennéét",000ProtocoloPrevencionSuicidio3 Navarra.pdf,¿Cuál es el riesgo de suicidio durante los primeros seis meses después de un intento?,El riesgo de suicidio durante los primeros seis meses después de un intento es considerablemente alto.,bertin-project/bertin-gpt-j-6B-alpaca,5
6,"La formación transversal en el ámbito de Salud compete en primer lugar al Departamento de Salud, en concreto al Plan Docente anual, que marca las líneas prioritarias de la formación. Desde ahí se plantearía la necesidad de formación a los distintos profesionales en esta temática de prevención y abordaje de la conducta suicida. Es destacable que durante los años 2010, 2011 y 2012 el Departamento de Salud desarrolló en su Plan Docente un curso de Urgencias Psiquiátricas que sería bueno actualizar de forma periódica. Su objetivo general era la capacitación básica para el manejo del paciente mental grave en crisis aguda con riesgo de agitación y suicidio. Como objetivos específicos se destacaban la aplicación del Protocolo de atención integral en emergencias y traslados urgentes por enfermedad mental, detección del riesgo, habilidades y pautas de intervención. La RSMNa dispone de la Unidad Docente Multidisciplinar específica y una Comisión de Formación Continuada cuyo objetivo principal es",000ProtocoloPrevencionSuicidio3 Navarra.pdf,¿Cuál es el papel de la RSMNa en la formación transversal en el ámbito de Salud?,"La RSMNa tiene como objetivo general la capacitación básica para el manejo del paciente mental grave en crisis aguda con riesgo de agitación y suicidio. Como objetivos específicos se destacan la aplicación del Protocolo de atención integral en emergencias y traslados urgentes por enfermedad mental, detección del riesgo, habilidades y pautas de intervención. La RSMNa dispone de la Unidad Docente Multidisciplinar específica y una Comisión de Formación Continuada cuyo objetivo principal es la capacitación en esta temática.",bertin-project/bertin-gpt-j-6B-alpaca,6
7,"En las tentativas de suicidio se diagnostica algún tipo de enfermedad médica en el 20-30% de los casos. 7.2.2. Protocolos en uso de prevención y actuación ante conductas suicidas en salud mental. PPrroottooccoolloo ddee pprreevveenncciióónn ddee llaass ccoonndduuccttaass ssuuiicciiddaass eenn llaass UUnniiddaaddeess ddee HHoossppiittaalliizzaacciióónn PPssiiqquuiiááttrriiccaass. (cid:157) Objetivo: extremar y ordenar las medidas de seguridad, ayudar al reconocimiento de signos y síntomas de riesgo, organizar la planificación de intervenciones y toma de decisiones y velar por la seguridad del paciente psiquiátrico ingresado. (cid:157) Define acciones necesarias que se deben llevar a cabo por los equipos de las Unidades durante el ingreso y tras el alta. (cid:157) Será aplicado a todos los pacientes que ingresen en las Unidades, especialmente aquellos con conducta suicida previa u otros factores de riesgo para el suicidio. Se hace extensivo a todos los psiquiatras y residentes de psiquia",000ProtocoloPrevencionSuicidio3 Navarra.pdf,¿Cuáles son los protocolos en uso de prevención y actuación ante conductas suicidas en salud mental?," Los protocolos en uso de prevención y actuación ante conductas suicidas en salud mental incluyen la implementación de medidas de seguridad para el paciente psiquiátrico, la organización de la planificación de intervenciones y toma de decisiones, y la vigilancia de la seguridad del paciente psiquiátrico ingresado.",bertin-project/bertin-gpt-j-6B-alpaca,7
8,"En SMIJ se está trabajando en el seno del Comité de Mejora de Coordinación Atención Primaria/Salud Mental un documento que pretende mejorar la colaboración entre ambos niveles y explicita criterios de derivación de Atención Primaria a SM, así como la diferenciación entre trastorno y problema. Dicho documento recoge una parte específica para la conducta suicida y propone una guía para evaluar la conducta suicida en Atención Primaria, que se anexa en este documento y se adapta para el resto de ámbitos que trabajan con el menor. 0 5 a n i g á P ACTUACIÓN DEL SISTEMA DE SALUD ANTE EL SUICIDIO 7 Esta Guía de evaluación se ha adaptado y mejorado para este Protocolo e incluye recomendaciones sobre cómo y qué preguntar y es aplicable a todos los ámbitos que trabajan con el menor, ya sea Pediatría, Salud Mental, Educación y Servicios Sociales (Anexo3). Es evidente la necesaria colaboración en el área Infanto-Juvenil en todos los casos en los que la intervención supera el ámbito de Salud. La exi",000ProtocoloPrevencionSuicidio3 Navarra.pdf,¿Cuál es el papel de los Servicios Sociales en la intervención con menores que presentan conductas suicidas?," Los Servicios Sociales tienen un papel importante en la intervención con menores que presentan conductas suicidas, ya que son los encargados de realizar la valoración del riesgo y derivar al menor al especialista correspondiente.",bertin-project/bertin-gpt-j-6B-alpaca,8
9,"(cid:157) Contextualización de este Modelo de prevención e intervención de conductas suicidas en cada centro educativo, incluyendo una “guía de evaluación de riesgo de conductas suicidas en menores”, de tal manera que se aprovechen las estructuras y procedimientos ya habituales en los centros educativos. (cid:157) Confirmación de la señal de alarma en las siguientes situaciones: (1) cuando cualquier docente detecte varios factores de riesgo, (2) cuando el orientador u orientadora aplique la guía de evaluación y constate el riesgo, (3) cuando una familia trasmita su preocupación sobre la situación emocional o la salud mental de su hijo o hija, (4) a partir del conocimiento de un recurso asistencial, (5) cuando se produzca una verbalización o (6) se presenten acontecimientos autolíticos. 7 5 a n i g á P 8 ACTUACIÓN DEL SISTEMA DE EDUCACIÓN ANTE EL SUICICIO. (cid:157) Activación del plan de prevención e intervención de la conducta suicida del centro, si se constata la situación de riesgo ",000ProtocoloPrevencionSuicidio3 Navarra.pdf,¿Cuál es el propósito de la guía de evaluación de riesgo de conductas suicidas en menores?,"La guía de evaluación de riesgo de conductas suicidas en menores está diseñada para identificar y abordar los factores de riesgo de la conducta suicida en los menores, y proporcionar intervenciones de apoyo y recursos para ayudar a reducir el riesgo.",bertin-project/bertin-gpt-j-6B-alpaca,9
10,"(cid:157) Participación activa en la formación dirigida a las familias, en temáticas relacionadas con la educación socio-emocional y en valores éticos de sus hijos e hijas. (cid:157) Apertura para utilizar los recursos comunitarios (pediatría, salud mental, servicios sociales…). AAccttuuaacciioonneess ddeell DDeeppaarrttaammeennttoo ddee EEdduuccaacciióónn:: (cid:157) Diseño de actividades formativas sobre los temas de duelo y prevención de conductas suicidas, en cada plan anual de formación para el profesorado. (cid:157) Asesoramiento a las comunidades educativas a través de la Inspección Educativa y de la Asesoría para la Convivencia, en los casos en que se solicite. 8 5 a n i g á P ACTUACIÓN DEL SISTEMA DE EDUCACIÓN ANTE EL SUICIDIO. 8 (cid:157) Impulso de medidas de colaboración entre los centros educativos y otros la sensibilización y desarrollo de medidas profesionales especializados, para preventivas y recursos asistenciales. En este marco se sitúa el “Convenio de colaboración e",000ProtocoloPrevencionSuicidio3 Navarra.pdf,¿Cuál es el propósito del Convenio de colaboración entre los centros educativos y otros recursos asistenciales para prevenir el suicidio?,El propósito del Convenio de colaboración es desarrollar e implementar medidas preventivas y asistenciales para reducir el riesgo de suicidio en el alumnado y personal de los centros educativos.,bertin-project/bertin-gpt-j-6B-alpaca,10
11,"El Centro de Gestión de Emergencias 112 SOS Navarra tiene por misión el facilitar a los ciudadanos, en el ámbito de la Comunidad Foral de Navarra, un acceso rápido, fácil y gratuito a los servicios de urgencias, emergencias y seguridad de la Comunidad Foral de Navarra, cualquiera que sea la Administración Pública de la que dependan. Este servicio se presta mediante la atención telefónica personalizada de las llamadas de urgencia y emergencia efectuadas por los ciudadanos, y el aviso inmediato a los distintos organismos encargados de la resolución del incidente, así como la coordinación de los mismos. La atención de llamadas de emergencia da lugar a que en muchas ocasiones sea el Centro de Gestión de Emergencias el primer contacto con las diversas situaciones que pueden generar conductas suicidas o con las propias conductas: atención a enfermos mentales, víctimas de violencia de género, menores o mayores maltratados por su entorno familiar, consumidores de sustancias estupefacientes son",000ProtocoloPrevencionSuicidio3 Navarra.pdf,¿Cuál es el propósito del Centro de Gestión de Emergencias 112 SOS Navarra?,"El propósito del Centro de Gestión de Emergencias 112 SOS Navarra es facilitar a los ciudadanos, en el ámbito de la Comunidad Foral de Navarra, un acceso rápido, fácil y gratuito a los servicios de urgencias, emergencias y seguridad de la Comunidad Foral de Navarra, cualquiera que sea la Administración Pública de la que dependan.",bertin-project/bertin-gpt-j-6B-alpaca,11
12,"Menor y Director/a Servicio Profesional de referencia Director/a del centro Director/a del Centro Equipo técnico Infanto-Juvenil En los días siguientes: Valorar las necesidades de apoyo a adultos y otros menores de la familia y ofrecer mediación para obtener los apoyos que se consideren o articularlos directamente (EAIA, Centro de Salud Mental, Servicio de Orientación, Equipo externo…) Información a la prensa: comunicación por teléfono a los medios, evitando la publicidad en la medida de lo posible y acordando los términos en que se dará la información en caso de que sea preciso Recogida de información y elaboración de informe Comunicar los hechos a las familias del resto de menores Evaluación y análisis. Establecimiento de posibles modificaciones en el protocolo de prevención de conductas suicidas Entrevista con la familia para: (cid:157) Entregar enseres del menor (cid:157) Entregar la Resolución de baja del centro (cid:157) Dar información pormenorizada de lo que se sabe y legalment",000ProtocoloPrevencionSuicidio3 Navarra.pdf,¿Cuál es el propósito de la Resolución de baja del centro?,La Resolución de baja del centro es emitida por el Director/a del centro y tiene como objetivo permitir que un menor sea entregado a su familia o ser puesto en una familia adoptiva alternativa. También se utiliza a veces para permitir que un menor sea dado de alta del centro debido a que ya no es necesario que permanezca allí.,bertin-project/bertin-gpt-j-6B-alpaca,12
13,"(cid:157) Preparación de documentos para cuando no esté: cartas de despedida, testamento, seguro de vida… (cid:157) Despedidas o contactos telefónicos con gente con la que tiene poco contacto habitualmente. (cid:157) Donación de objetos de valor. (cid:157) Aparición de lesiones o cortes recientes. Estado anímico: 0 7 a n i g á P ACTUACIÓN DEL SISTEMA DE SERVICIOS SOCIALES. 9 (cid:157) Desesperanza, tristeza, sentimiento de culpa, síntomas somáticos como falta de apetito, pérdida de sueño… Entrevista Estructurada para la Evaluación de la Conducta Suicida (adaptada del C-SSRS). Se recomienda aplicarla cuando la presencia de conductas, verbales o no, indican riesgo de intento autolítico (Anexo 2) y Anexo 3 en el caso de adolescentes y niños/as mayores). 9.5.2. Actuaciones ante el Riesgo (Ver flujograma 8 capítulo 12). Los centros residenciales deben elaborar sus propios protocolos. Algunos, como las Residencias de Atención a Enfermos Mentales (RAEM) o algunos centros de menores ya cuentan",000ProtocoloPrevencionSuicidio3 Navarra.pdf,¿Cuál es el propósito de la entrevista estructurada para la evaluación de la conducta suicida (C-SSRS)?,"La entrevista estructurada para la evaluación de la conducta suicida (C-SSRS) se utiliza para evaluar el riesgo de suicidio en individuos que puedan estar en alto riesgo de comportamiento suicida. Se recomienda cuando la presencia de ciertas conductas, verbales o no, indican un alto riesgo de intento autolítico. La entrevista está adaptada del Cuestionario de Evaluación de la Conducta Suicida (C-SSRS).",bertin-project/bertin-gpt-j-6B-alpaca,13
14,"Se calcula que un suicidio tiene un serio impacto sobre al menos otras 6 personas y que en el caso de jóvenes, este impacto es mucho mayor. En los últimos años se multiplican las iniciativas para prevenir los suicidios, encabezadas por la Organización Mundial de la Salud, que ya en 1999 lanzó el programa SUPRE (Suicide Prevention/Prevención del Suicidio). En España son varias las Comunidades Autónomas que cuentan con documentos encaminados a la prevención del suicidio y el Ministerio de Sanidad publicó en 2011 la “Guía de Práctica Clínica de Prevención y Tratamiento de la Conducta Suicida” orientada al ámbito sanitario. El fenómeno del suicidio requiere para su correcto abordaje la atención de diversas autoridades públicas (no solo sanitarias) y de las organizaciones de la sociedad civil. Diversas investigaciones indican que la prevención del suicidio requiere una serie de actividades que van desde la provisión de las mejores condiciones posibles para la educación de jóvenes y niños y ",000ProtocoloPrevencionSuicidio3 Navarra.pdf,¿Cuál es el impacto estimado del suicidio en otras 6 personas?,"Se estima que el suicidio tiene un impacto grave en otras 6 personas, lo que resulta en una amplia gama de efectos emocionales, sociales y económicos para las familias y comunidades afectadas.",bertin-project/bertin-gpt-j-6B-alpaca,14
15,"Por un lado, informar de los hechos objetivamente y que pueden ser de interés del público y por otro, respetar el derecho a la privacidad y el dolor de la familia y evitar cualquier referencia que pudiera impactar negativamente en las personas vulnerables. Una política de información sensible a los efectos sobre la población debe incluir: (cid:157) Sensibilización de que el suicidio es un fenómeno complejo y multifactorial. (cid:157) El estigma que actualmente existe sobre la conducta suicida perjudica y causa problemas de salud emocional y mental. Los medios deben contribuir informando con veracidad sobre este fenómeno y contribuyendo a tratar el tema para superar el tabú. (cid:157) Difundir información sobre servicios de apoyo y teléfonos de contacto Expresiones a evitar (cid:131) Intento de suicidio exitoso (cid:131) Intento de suicidio frustrado (cid:131) Cometer suicidio (asociado con crimen) (cid:131) Víctima de suicidio (cid:131) Grito de ayuda (cid:131) Persona propensa al suic",000ProtocoloPrevencionSuicidio3 Navarra.pdf,¿Cuál es la política de la empresa con respecto al suicidio?,La política de la empresa es que cualquier empleado que se sienta abrumado o desafiado por problemas personales o familiares y que esté considerando el suicidio debe buscar ayuda de inmediato.,bertin-project/bertin-gpt-j-6B-alpaca,15
16,"Decir que alguien se ha ahorcado es mejor que decir que alguien se ha ahorcado en su habitación usando su camiseta de futbol. (cid:157) Evitar explicaciones simplistas 31Keith Hawton, “Samaritans Media Guidelines,” Samaritans (September 9, 2009): 1–32. 4 0 1 a n i g á P LA PREVENCIÓN DESDE LOS MEDIOS DE COMUNICACIÓN 14 (cid:131) El suicidio nunca es el resultado de un factor o acontecimiento. Son muchos los factores interrelacionados. (cid:131) Ej. Decir que la notificación de desahucio fue la causa del suicidio. Por otro lado, la relevancia que adquiere esta noticia en los medios ejerce una poderosa influencia en personas vulnerables. (cid:157) Evitar revelar el contenido de cualquier nota de suicidio (cid:131) Esta información atribuye al suicidio un carácter sensacionalista y romántico. Puede animar a otras personas a identificarse con el fallecido, sin olvidar el dolor que causa a la familia. (cid:157) No dar cobertura repetitiva a los memoriales públicos (cid:131) Las manifestacio",000ProtocoloPrevencionSuicidio3 Navarra.pdf,¿Cuál es la importancia de la notificación de desahucio en el suicidio de una persona?," La notificación de desahucio es un factor importante en el suicidio de una persona, ya que puede ser una señal de un problema de salud mental subyacente. También puede ser una señal de una situación financiera difícil, lo que lleva a un sentido de impotencia y desesperanza. Por lo tanto, es importante reconocer la notificación de desahucio como un posible factor contribuyente en el suicidio de una persona.",bertin-project/bertin-gpt-j-6B-alpaca,16
