,Contexto,Documento,Pregunta,Respuesta,Modelo,Indice original
218,"Los guardianes comunitarios y los trabajadores de la salud no especializados deben sentirse seguros para detectar, apoyar y derivar a las personas en riesgo de suicidio, incluida la ejecución de intervenciones psicológicas diseñadas para su uso en entornos adversos (OMS, 2016b). Se puede dar prioridad a los servicios a los que acudirían las personas en riesgo, como los servicios de atención primaria de salud y los programas centrados en responder a inquietudes acerca de la protección (incluida la protección infantil y la violencia de género). • Cuando el apoyo en persona a la salud mental sea limitado, establecer sistemas de apoyo a distancia (OMS, 2018c). Asegurarse de que el personal reciba formación y se sienta cómodo al utilizar métodos remotos de comunicación, particularmente cuando gestionan el riesgo6. • • • • A fin de asegurar una cobertura adecuada para atender las necesidades, evitar reasignar a tareas ajenas a la prevención del suicidio a aquellas personas clave que trabajan",2021 OMS GUÍA DE APLICACIÓN PARA LA PREVENCIÓN DEL SUICIDIO EN LOS PAÍSES.pdf,¿Qué medidas se están tomando para garantizar que el personal de salud mental reciba la formación adecuada para detectar y apoyar a las personas en riesgo de suicidio?,"Se están tomando medidas para garantizar que el personal de salud mental reciba la formación adecuada para detectar y apoyar a las personas en riesgo de suicidio, incluyendo la formación en detección y prevención del suicidio, así como en técnicas de intervención y apoyo.",bertin-project/bertin-gpt-j-6B-alpaca,218
219,"Las consecuencias suelen ser devastadoras, tanto para los bebés que pierden a sus madres, como para las familias, cuyo sufrimiento desborda los parámetros habituales acerca de los costes sociales y sanitarios. La sociedad, por otra parte, suele asistir atónita y perpleja a este tipo de tristísimas noticias. Los servicios dedicados a las futuras madres (y padres) contienen una ingente cantidad de productos para la crianza y la salud maternoﬁlial que ocuparía varios párrafos enumerar detenidamente. ¿Cómo es posible que entre tal cantidad de material no destaque por su –literalmente– vital importancia alguna recomendación o recurso sobre cómo abordar los posibles pensamientos de suicidio durante este periodo? Un fenómeno complejo No estamos ante un asunto nada fácil. Tras varias décadas de investigación aún no tenemos una narrativa coherente que permita comprender la compleja asociación entre maternidad y suicidio. Sí parece que hay consenso entre los investigadores acerca de que durante ",2021 suicidio y maternidad.pdf,¿Cuáles son las consecuencias de la pérdida de una madre durante el embarazo o el parto?,"Las consecuencias de la pérdida de una madre durante el embarazo o el parto pueden ser devastadoras tanto para los bebés como para las familias. Los bebés que pierden a sus madres a menudo experimentan una amplia gama de emociones, incluyendo la tristeza, la ira, el miedo y la confusión. Para las familias, el impacto emocional de la pérdida puede ser abrumador, con una mezcla de sentimientos de dolor, shock, culpa, confusión y pérdida. En algunos casos, la familia puede experimentar una sensación de impotencia y sentir que no hay forma de superar la pérdida. En otros casos, la familia puede buscar apoyo en la religión, los amigos o la terapia para procesar sus sentimientos y aceptar la pérdida. En cualquier caso, es un momento difícil y uno que requiere mucho coraje y resiliencia para superar.",bertin-project/bertin-gpt-j-6B-alpaca,219
220,"Con los datos con los que se cuenta, dependiendo de la valoración inicial de las posibles circunstancias de riesgo (valoración de señales de alarma y factores de riesgo y de protección -ver más adelante-) y de cada situación concreta, el centro educativo, siguiendo los pasos establecidos y protocolizados, con el debido asesoramiento del Servicio de Inspección Educativa y/o del Equipo de apoyo socioemocional (Unidad de convivencia) dependiente de la Subdirección General de Inspección Educativa (a los efectos del asesoramiento para el desarrollo del protocolo e implementación del plan), podrá adaptar las ideas y pautas detalladas en el presente documento, en el contexto de un riguroso proceso de reflexión y análisis, y elaborar una propuesta de Plan de prevención, protección e intervención para las situaciones de riesgo o evidencia de conducta suicida y autolesiones. Más allá de cualquier consideración sobre hipótesis causales, que deberán ser abordadas en el contexto profesional especia",2022 C.Madrid La conducta suicida en Centros Educativos .pdf,"¿Cuál es el propósito de un plan de prevención, protección e intervención para las situaciones de riesgo o evidencia de conducta suicida y autolesiones?","El propósito de un plan de prevención, protección e intervención para las situaciones de riesgo o evidencia de conducta suicida y autolesiones es reducir la probabilidad de que ocurran estas conductas, minimizar el daño potencial y proporcionar una intervención oportuna y efectiva cuando sea necesario. El plan debe adaptarse a las necesidades y circunstancias específicas del centro educativo y debe incluir procedimientos claros para la notificación, evaluación y respuesta a las situaciones de riesgo. También debe incluir formación y sensibilización para todo el personal, así como para los padres y las madres, y cualquier otro miembro de la comunidad educativa relevante.",bertin-project/bertin-gpt-j-6B-alpaca,220
221,"Esto ha posibilitado colaboraciones con actividades formativas y de sensibilización y encuentros en los que hemos podido conocer el encomiable trabajo que realiza. ¿Cómo se puede trabajar con el estigma en salud mental y la conducta suicida? Información, formación, comprensión y humanización. El dolor emocional es humano.; y el sufrimiento; y las crisis. Y la vulnerabilidad también. Todos somos vulnerables y ante situaciones vividas como intolerables e irreversibles, podemos entrar en crisis y avanzar hacia la desesperanza y la desconexión vital. La profesión de guardia civil supone algunas variables personales y profesionales que estresan de por sí, y negarlo cierra la posibilidad de prevenir y abordar. Antes que militares somos humanos. En cuerpos militares de élite de EE.UU. con tasas elevadas de suicidio entre sus miembros se ha aplicado una política de intervención por la que quien está en situación de malestar o sufrimiento y pide ayuda es validado con un reconocimiento. Una vez ",2022 Entrevista Magdalena Pérez.pdf,¿Cómo se puede trabajar con el estigma en salud mental y la conducta suicida?,"Información, formación, comprensión y humanización. El dolor emocional es humano.; y el sufrimiento; y las crisis. Y la vulnerabilidad también. Todos somos vulnerables y ante situaciones vividas como intolerables e irreversibles, podemos entrar en crisis y avanzar hacia la desesperanza y la desconexión vital. La profesión de guardia civil supone algunas variables personales y profesionales que estresan de por sí, y negarlo cierra la posibilidad de prevenir y abordar. Antes que militares somos humanos. En cuerpos militares de élite de EE.UU. con tasas elevadas de suicidio entre sus miembros se ha aplicado una política de intervención por la que quien está en situación de malestar",bertin-project/bertin-gpt-j-6B-alpaca,221
222,"(cid:120) Conocer el entorno/contexto (familiar, escolar, amistades, etc.) de los niños/as y adolescentes con ideas e intentos de suicidio. (cid:120) Analizar en profundidad este fenómeno, a través de una muestra de casos de niños, niñas y adolescentes atendidos/as en ANAR. (cid:120) Analizar la implicación de las tecnologías en la situación de la conducta suicida en menores de 18 años. (cid:120) Detectar los factores de riesgo y protección ante conductas suicidas en la infancia y adolescencia. (cid:120) Analizar la percepción y visión sobre este fenómeno de los y las profesionales que atienden las Líneas de Ayuda ANAR e intervienen en estos casos. (cid:120) Realizar propuestas y recomendaciones de prevención de ideas e intentos de suicidio en menores de 18 años, para minimizar los suicidios consumados. El aallccaannccee del estudio es de ámbito nacional, ya que se circunscribe al estudio de la conducta suicida y la salud mental en niños/as y adolescentes residentes en España, siempre ",2022 F. ANAR CONDUCTA SUICIDA Y SALUD MENTAL EN LA INFANCIA Y ADOLESCENCIA EN ESPAÑA 2012 - 2022.pdf,"¿Cuál es el entorno familiar, escolar y social de los niños y adolescentes con ideas e intentos de suicidio?","El entorno familiar, escolar y social de los niños y adolescentes con ideas e intentos de suicidio suele ser de apoyo y comprensión, aunque también puede ser de estrés y ansiedad. En el entorno familiar, los niños y adolescentes suelen tener una red de apoyo sólida, aunque también pueden experimentar sentimientos de aislamiento y soledad. En el entorno escolar, los niños y adolescentes pueden tener dificultades para adaptarse a las expectativas y normas de la escuela, así como sentirse excluidos o rechazados. En el entorno social, los niños y adolescentes pueden tener dificultades para hacer amigos y sentirse aislados.",bertin-project/bertin-gpt-j-6B-alpaca,222
223,"LLaa iinnfflluueenncciiaa ddee llaass tteeccnnoollooggííaass Tal y como Fundación ANAR ha venido reivindicando en los últimos años, abalándolo con sus estudios e informes, es fundamental regular el acceso, por los niños/as y adolescentes, a Internet y medios digitales para evitar que se vean expuestos a contenidos inapropiados y esta implicación también es clave desde las familias que desconocen los riesgos existentes. Por ello, se sugiere desde ANAR el desarrollo de programas educativos dirigido a las familias, pero también a los/as profesionales que trabajan con la infancia y adolescencia para que sepan identificar posibles señales de riesgo. Aparte del papel de los padres/madres, centros educativos y profesionales que trabajan con la infancia y la adolescencia, las empresas tecnológicas y de la comunicación, así como los/as internautas también tienen un papel importante en la reducción de las conductas suicidas. Ya se están tomando medidas por parte de las principales tecnológicas (",2022 F. ANAR CONDUCTA SUICIDA Y SALUD MENTAL EN LA INFANCIA Y ADOLESCENCIA EN ESPAÑA 2012 - 2022.pdf,¿Cuál es la importancia de regular el acceso a Internet y medios digitales por parte de los niños/as y adolescentes?,"Es fundamental regular el acceso a Internet y medios digitales para evitar que los niños/as y adolescentes se expongan a contenidos inapropiados. Desde Fundación ANAR hemos venido reivindicando esta regulación desde hace años, basándonos en nuestros estudios e informes, y es importante que las familias sean conscientes de los riesgos existentes. Por ello, se sugiere el desarrollo de programas educativos dirigidos a las familias, pero también a los/as profesionales que trabajan con la infancia y la adolescencia para que sepan identificar posibles señales de riesgo. Las empresas tecnológicas y de la comunicación, así como los/as internautas, también tienen un papel importante en la reducción de las conductas suicidas.",bertin-project/bertin-gpt-j-6B-alpaca,223
224,"Igualmente, según la OMS resulta inapropiado utilizar estereotipos religiosos o culturales. (cid:120) NNoo ddeessccrriibbiirr eexxppllíícciittaammeennttee eell lluuggaarr,, eell mmééttooddoo uussaaddoo yy ccóómmoo lloo oobbttuuvvoo llaa vvííccttiimmaa, ni otros detalles de la muerte que puedan resultar ofensivos para la ellos/as, sus familiares y entorno social. Mucho menos si pueden contribuir a su imitación. Proporcionar muchos detalles podría estimular a otras personas a probar esos métodos. Según la OMS se ha demostrado que la cobertura por parte de los medios ofrece un mayor impacto al detallar el método de suicidio adoptado. Así, la referencia a ciertos escenarios puentes, acantilados, edificios, etc. asociados con el suicidio aumenta el riesgo de que se recurra a ellos. (cid:120) NNoo rreedduucciirr eell ssuuiicciiddiioo aa uunnaa úúnniiccaa ccaauussaa, es decir, hay que evitar dar una visión simplista, ni basada en la especulación: este fenómeno es complejo y multicausal y resu",2022 F. ANAR CONDUCTA SUICIDA Y SALUD MENTAL EN LA INFANCIA Y ADOLESCENCIA EN ESPAÑA 2012 - 2022.pdf,¿Qué está causando que más personas se suiciden en todo el mundo?,"Las causas del aumento del suicidio en todo el mundo son complejas y varían según la región y el contexto cultural. Algunos factores potenciales incluyen la presión social por lograr éxito y perfección, la disponibilidad de métodos de suicidio fácilmente accesibles, la salud mental deficiente, el aislamiento social y la desesperanza. Es importante reconocer que el suicidio no es una solución a problemas complejos y que buscar ayuda es importante.",bertin-project/bertin-gpt-j-6B-alpaca,224
225,"Si esta sensación no se supera hay mayor posibilidad de 40 www.anar.org 41 MARCO TEÓRICO MARCO TEÓRICO pasar a tener una percepción de atrapamiento (desmotivación para escapar de la amenaza o el estrés) a partir de la que surge la posibilidad de acabar con la propia vida como vía de escape. En el tránsito de la percepción de derrota a la percepción de atrapamiento hay una serie de factores moderadores que pueden potenciar (déficit de habilidad para resolver problemas, experiencias personales negativas, rumiación) o disminuir este tránsito (percepción de alternativas de escape, visión de un futuro más positivo y menos doloroso). 33. Volitiva: los factores moderadores implicados en el paso de la fase motivacional a la volitiva pueden ser ambientales (ej. acceso a medios de ejecución de la conducta suicida), sociales (ej. exposición a conducta suicida de otros/as, representación inapropiada y/o glamurosa del suicidio) o psicológicos (ej. escaso miedo a la muerte, historia pasada de conduc",2022 F. ANAR CONDUCTA SUICIDA Y SALUD MENTAL EN LA INFANCIA Y ADOLESCENCIA EN ESPAÑA 2012 - 2022.pdf,¿Cuáles son los factores moderadores que pueden potenciar o disminuir el tránsito de la percepción de derrota a la percepción de atrapamiento?,"Los factores moderadores que pueden potenciar o disminuir el tránsito de la percepción de derrota a la percepción de atrapamiento son los ambientales (ej. acceso a medios de ejecución de la conducta suicida), sociales (ej. exposición a conducta suicida de otros/as, representación inapropiada y/o glamurosa del suicidio) y psicológicos (ej. escaso miedo a la muerte, historia pasada de conducción suicida, historia pasada de éxito en la resolución de problemas).",bertin-project/bertin-gpt-j-6B-alpaca,225
226,"Así, una ruptura sentimental, el fracaso escolar, muerte de un ser querido, etc. pueden provocar, por el efecto mariposa, un derrumbe total del sujeto y autodestruirse. Por tanto, lo importante es cómo vive la persona la nueva situación, y no tanto el factor desencadenante. En este sentido, el profesor Alejandro Rocamora Bonilla (2022), señala que la conducta suicida es un proceso complejo, no lineal, con avances y retrocesos y multidimensional. De hecho, el llamado factor desencadenante puede ser aparentemente nimio y sin ninguna gravedad (por ejemplo, suspender un examen) y, sin embargo, la “situación” en que se vive, y más concretamente “cómo vive la persona esa situación” (los mecanismos de afrontamiento utilizados) es lo que puede inclinar la balanza hacia la vida o la muerte. Las razones, pues, para llegar al suicidio pueden ser muy diversas y generalmente no existe una sola. Mas bien, lo que lleva a tomar esa decisión es una “situación” (angustia, soledad, desesperanza, falta de",2022 F. ANAR CONDUCTA SUICIDA Y SALUD MENTAL EN LA INFANCIA Y ADOLESCENCIA EN ESPAÑA 2012 - 2022.pdf,¿Cuál es el factor desencadenante de un suicidio?,"El factor desencadenante de un suicidio puede ser aparentemente nimio y sin ninguna gravedad (por ejemplo, suspender un examen) y, sin embargo, la ""situación"" en que se vive, y más concretamente ""cómo vive la persona esa situación"" (los mecanismos de afrontamiento utilizados) es lo que puede inclinar la balanza hacia la vida o la muerte. Las razones, pues, para llegar al suicidio pueden ser muy diversas y generalmente no existe una sola. Mas bien, lo que lleva a tomar esa decisión es una ""situación"" (angustia, soledad, desesperanza, falta de esperanza, etc.) que hace que la persona no pueda lidiar con sus problemas y encuentre una salida fácil y rápida al no soportar más el sufrimiento.",bertin-project/bertin-gpt-j-6B-alpaca,226
227,"Los datos existentes señalan que la conducta suicida se da con más frecuencia en la población adolescente, en particular entre los 15 y 19 años de edad, y en la edad adulta, que en los menores de edad que no han llegado a la pubertad. No obstante, “el suicidio también se da en niños/as y preadolescentes, por lo que este problema potencial no debe ser subestimado” (Elia, 2021). A pesar de la existencia de diversos enfoques orientados a comprender el fenómeno del suicidio, muchos aspectos siguen permaneciendo invisibilizados y silenciados, por lo complejo y delicado de la temática. Además, aunque la OMS lo define como un problema prevenible, aún supone una gran carga de morbimortalidad, puesto que se trata de un problema muy desconocido con pocos estudios que ofrezcan datos serios y confiables de este fenómeno, que pongan de manifiesto la necesidad de crear políticas públicas transversales. El suicido constituye una prioridad global de salud pública y los datos disponibles ponen de manif",2022 F. ANAR CONDUCTA SUICIDA Y SALUD MENTAL EN LA INFANCIA Y ADOLESCENCIA EN ESPAÑA 2012 - 2022.pdf,¿Qué tan serios y confiables son los datos disponibles sobre el suicidio?,"Los datos disponibles sobre el suicidio son en gran parte insuficientes y poco confiables, ya que la mayoría de las estadísticas provienen de países de altos ingresos con tasas de suicidio más altas, y la mayoría de las fuentes de datos no son de fácil acceso para los investigadores. Además, la mayoría de los estudios existentes se centran en los comportamientos y tendencias del suicidio en adultos, y no abordan el suicidio en niños y adolescentes. Esto hace que sea difícil obtener una imagen precisa de la prevalencia y la dinámica del suicidio en diferentes grupos de edad.",bertin-project/bertin-gpt-j-6B-alpaca,227
228,"Se trata de un problema de salud pública y todos somos agentes de prevención (OMS, 2014). El suicidio infantil, entendido como el acto por el cual el niño/a provoca voluntariamente su muerte, es un fenómeno complejo y difícil de explicar. www.anar.org 14 www.anar.org INTRODUCCIÓN INTRODUCCIÓN de estos, sino que tiene que ver con un estado de bienestar emocional, en el que, a los determinantes de carácter individual, se les unen factores sociales, culturales, económicos, políticos o medioambientales. Por su parte, la Estrategia de Salud Mental del Sistema Nacional de Salud, periodo 2022- 2026, identifica como población objeto de análisis a toda la población, no sólo a aquella que haya desarrollado una sintomatología o recibido un diagnóstico, y se detiene especialmente en la población intantojuvenil como especial población de riesgo. Esta Estrategia así mismo apuesta por un enfoque biopsicosocial de la salud mental. La salud mental y, en concreto, la conducta suicida en la infancia y ad",2022 F. ANAR CONDUCTA SUICIDA Y SALUD MENTAL EN LA INFANCIA Y ADOLESCENCIA EN ESPAÑA 2012 - 2022.pdf,¿Cómo se puede explicar el suicidio infantil?,"El suicidio infantil es un fenómeno complejo y difícil de explicar. Puede ser causado por una variedad de factores, incluyendo problemas de salud mental, factores de estrés ambiental, factores sociales y culturales, y factores individuales. Es importante reconocer que el suicidio infantil no siempre es un acto de desesperación o desesperanza, sino que tiene que ver con un estado de bienestar emocional, en el que, a los determinantes de carácter individual, se les unen factores sociales, culturales, económicos, políticos o medioambientales.",bertin-project/bertin-gpt-j-6B-alpaca,228
229,"MMaayyoorreess rreeccuurrssooss Desde la Fundación ANAR se identifica la necesidad de más recursos especializados y profesionales destinados/as a atender temáticas sensibles que suponen un riesgo para la salud de niños/as y adolescentes: suicidio, autolesiones, agresiones sexuales, adicciones a tecnologías, para que no exista tanta demora en la atención. En este sentido, se recomienda reducir las desigualdades y las brechas de acceso de la población infantojuvenil al sistema sanitario. Además, niños/as y adolescentes sin suficientes recursos económicos se encuentran en desventaja al ver limitada la posibilidad de atención y asistencia psicológica que precisan ante las listas de espera y dilatación de las citas entre consultas en el sistema sanitario público. Atender con prontitud y prioridad a los problemas de salud mental en la infancia y adolescencia es fundamental. Ello es especialmente relevante tras los síntomas que indican la aparición de trastornos mentales graves. Por este moti",2022 F. ANAR CONDUCTA SUICIDA Y SALUD MENTAL EN LA INFANCIA Y ADOLESCENCIA EN ESPAÑA 2012 - 2022.pdf,¿Qué recursos especializados y profesionales se necesitan para atender temáticas sensibles que suponen un riesgo para la salud de niños/as y adolescentes?,"Se necesitan recursos especializados y profesionales para atender temáticas sensibles que suponen un riesgo para la salud de niños/as y adolescentes, como el suicidio, las autolesiones, las agresiones sexuales, las adicciones a tecnologías.",bertin-project/bertin-gpt-j-6B-alpaca,229
230,"Este Plan ha pretendido potenciar la prevención primaria, secundaria y terciaria del suicidio, y extender y generalizar los programas de prevención a toda la red asistencial de salud mental madrileña. También las acciones formativas y de sensibilización han sido objetivos priorizados. De cara al futuro se pretende elaborar y editar nuevas guías de prevención destinadas a poblaciones específicas de interés (adolescentes, ancianos o medios de comunicación). Este plan ha sido evaluado, con un 50% de actuaciones finalizadas y más de un 30% en desarrollo. Su continuación vendrá recogida, el ámbito de la sanidad, en el presente Plan, junto con las acciones desde otros ámbitos de la administración, con el enfoque multisectorial necesario para el abordaje de salud pública de la prevención del suicidio. El nuevo Plan de Salud Mental y Adicciones 2022-2024, prestará especial atención a la población infanto-juvenil y de mayores, a las personas con TMG y a las que presentan trastornos adictivos. E",2022 Madrid PLAN VIVIR.pdf,¿Cuáles son los objetivos del Plan de Salud Mental y Adicciones?," Los objetivos del Plan de Salud Mental y Adicciones son potenciar la prevención primaria, secundaria y terciaria del suicidio, y extender y generalizar los programas de prevención a toda la red asistencial de salud mental madrileña. También las acciones formativas y de sensibilización han sido objetivos priorizados. De cara al futuro se pretende elaborar y editar nuevas guías de prevención destinadas a poblaciones específicas de interés (adolescentes, ancianos o medios de comunicación). Este plan ha sido evaluado, con un 50% de actuaciones finalizadas y más de un 30% en desarrollo. Su continuación vendrá recogida, el ámbito de la sanidad, en el presente Plan, junto con las acciones desde otros ámbitos de la administración, con el enfoque multisectorial necesario para el abordaje de salud pública de la prevención del suicidio. El nuevo Plan de Salud Mental y Adicciones 2022-2024, prestará especial atención a la población infanto-juvenil y de mayores, a las personas con TMG y a las que presentan trastornos adictivos.",bertin-project/bertin-gpt-j-6B-alpaca,230
231,"• Protocolos de prevención del suicidio en los servicios de urgencia: Incluye un «check-list» que sistematiza la exploración del riesgo suicida y evita la omisión accidental de alguna pregunta clave en la detección del mismo por parte del psiquiatra de guardia. C. Acciones formativas. Se han desarrollado acciones formativas sobre detección y manejo del riesgo suicida para profesionales de Atención Primaria y del SUMMA 112 y sobre intervención en Salud Mental para profesionales de Salud Mental, de Psiquiatría y Psicología Clínica. Desde 2010 se han celebrado 113 ediciones con más de 4.532 alumnos (psiquiatras, psicólogos clínicos, médicos de AP y del SUMMA 112, enfermeras de salud mental, AP y SUMMA 112 y trabajadores sociales de toda la Consejería de Sanidad) y 799,5 horas docentes, que posteriormente han revertido en sus respectivos centros. En las ediciones celebradas desde 2020 se han incorporado a estos cursos, junto a los profesionales que lo imparten, personas supervivientes del ",2022 Madrid PLAN VIVIR.pdf,¿Qué medidas se han tomado para garantizar que el psiquiatra de guardia siga los protocolos de prevención del suicidio en los servicios de urgencia?,Las medidas tomadas para garantizar que el psiquiatra de guardia siga los protocolos de prevención del suicidio en los servicios de urgencia incluyen la implementación de un «check-list» que sistematiza la exploración del riesgo suicida y evita la omisión accidental de alguna pregunta clave en la detección del mismo por parte del psiquiatra de guardia.,bertin-project/bertin-gpt-j-6B-alpaca,231
