,Contexto,Documento,Pregunta,Respuesta,Modelo,Indice original
344,"El profesional de enfermería puede disminuir el deseo de suicidarse calmando esas crisis y tratando de ganar tiempo. - Rigidez. Los pensamientos, sentimientos y acciones de las personas suicidas son rígidos, ya que piensan continuamente en el suicidio y no perciben otras formas de afrontar el problema. Síntomas psiquiátricos asociados con el riesgo de suicidio También es importante conocer que hay algunos síntomas psiquiátricos asociados a las enfermedades mentales o a otras situaciones que aumentan el riesgo de suicidio, como25: - Ansiedad. Se ha encontrado un aumento del riesgo del suicidio con la ansiedad generalizada y con los ataques de pánico. - Desesperanza. Se ha descrito una relación directa con las expectativas de futuro de los pacientes. - Impulsividad y agresividad. Asociadas a otro tipo de patología como trastorno lími- te de personalidad aumentan el riesgo tanto de autolesión como de suicidio. Enfermedad psiquiátrica con mayor riesgo de suicidio: depresión La enfermedad p",16 Prevencion e intervencion enfermera en conducta suicida.pdf,¿Con qué se asocia la impulsividad y la agresividad?,Aumentar el riesgo de autolesión y suicidio,lmqg/t5-base-squad-qag,344
345,"Es necesario proporcionar a las enfermeras de atención primaria el conocimiento suficiente, oportuno y adecuado sobre las características principales del suicidio como problema de salud pública; sobre los indicadores suicidas, que son todas aquellas conductas o ideas que hacen probable la próxima ocurrencia de un comportamiento suicida, y sobre las orientaciones fundamentales para la intervención preventiva en los usuarios y en sus familias14. Según el documento elaborado por la oMS al respecto, los profesionales de Atención Primaria tienen un lugar privilegiado para la detección de factores de riesgo, ya que el centro de salud de atención primaria es a menudo la puerta de entrada a los servicios de salud de las personas con conducta suicida. Los médicos y las enfermeras de atención primaria tienen un papel importante en la detección de los pacientes con mayor riesgo de suicidio y en la prevención de esta conducta en la atención directa a los pacientes con problemas de salud mental, en",16 Prevencion e intervencion enfermera en conducta suicida.pdf,¿Quiénes tienen un papel importante en la detección de pacientes con mayor riesgo de suicidio?,Médicos y enfermeras de atención primaria,lmqg/t5-base-squad-qag,345
346,"Van desde el espacio donde se establece la relación hasta una serie de técnicas y/o habilidades que van a facilitar la expresión y elaboración de sentimientos por parte del paciente. Normalmente el primer contacto con la enfermera tendrá relación con que se 400 PREVENCIÓN E INTERVENCIÓN ENFERMERA EN LA CONDUCTA SUICIDA pueda establecer una valoración de necesidades de cuidados como primera etapa del proceso enfermero. El primer contacto con una persona que presenta conducta suicida es crucial. A veces ocurre en el hospital, en un sitio público o un domicilio, donde es complicado mantener una conversación privada7: - La primera actuación es conseguir un sitio adecuado, donde se pueda mantener una conversación tranquila y con razonable privacidad. - La siguiente actuación es asignar el tiempo necesario; los suicidas suelen necesitar más tiempo para desahogarse y hay que brindárselo. - Y lo más importante, escucharlos atentamente, esto ayuda a reducir el nivel de desesperación que sienten",16 Prevencion e intervencion enfermera en conducta suicida.pdf,¿Qué ayuda a reducir el hecho de escuchar a una persona suicida?,El nivel de desesperación que sienten,lmqg/t5-base-squad-qag,346
347,"- Los pacientes que expresen sentimientos extremos de desesperanza, impotencia o culpa. 410 PREVENCIÓN E INTERVENCIÓN ENFERMERA EN LA CONDUCTA SUICIDA - Pacientes que no presentan sistemas de apoyo social, viendo el suicidio como única solución. Los profesionales de enfermería deben estar muy atentos a cambios o mejorías repentinas en el paciente, ya que pueden significar un alivio secundario a una decisión firme de quitarse la vida. Comportamiento del paciente suicida La persona que quiere suicidarse suele presentar cambios en las emociones, en los pensamientos, en los hábitos y en el comportamiento habitual. Entre los posibles cambios podemos encontrar: tristeza, escribir notas de despedida, entrega de posesiones valiosas, aislamiento, incremento del consumo de alcohol, drogas u otras sustancias adictivas y presencia de trastornos del sueño como el no dormir o dormir todo el tiempo y trastornos del apetito. Las siguientes conductas son frecuentes entre personas que están considerando",16 Prevencion e intervencion enfermera en conducta suicida.pdf,¿Cuáles son algunos de los posibles cambios que podría presentar un paciente suicida?,"Tristeza, escribir notas de despedida, dar posesiones valiosas, aislamiento, aumento del consumo de alcohol, drogas u otras sustancias adictivas, y la presencia de trastornos del sueño como no dormir o dormir todo el tiempo y trastornos de la alimentación",lmqg/t5-base-squad-qag,347
348,"Estas alteraciones se asocian con riesgo de muerte, como en el caso del suicidio o pacientes con conducta violenta o de las situaciones de alteraciones mentales derivadas de consumo de drogas o enfermedades físicas que requieran intervención inmediata. Las más frecuentes situaciones de emergencia incluyen comportamiento suicida, comportamiento agresivo y trastornos de la percepción y el pensamiento16. Los servicios de urgencias, tanto hospitalarios como extrahospitalarios, tienen una gran relevancia en relación al suicidio, debido a que en muchas ocasiones son los primeros lugares en los que el paciente con ideación o conducta suicida toman contacto con el sistema sanitario suponiendo, además, un volumen de trabajo para estos profesionales nada despreciable. Los servicios de urgencias tienen la responsabilidad de realizar la valoración inicial de todos los pacientes que solicitan atención sanitaria y priorizarlos según su gravedad. En la atención al paciente con conducta suicida, el ob",16 Prevencion e intervencion enfermera en conducta suicida.pdf,¿Cuáles son las situaciones de emergencia más frecuentes?,"Comportamiento suicida, comportamiento agresivo y trastornos de la percepción y el pensamiento",lmqg/t5-base-squad-qag,348
349,"Aquéllos que tienen dificultades para caminar, ver y oír, también corren riesgo. El riesgo de suicidio aumenta en afecciones dolorosas y crónicas SUICIDIO – FACTORES SOCIODEMOGRÁFICOS Y MEDIOAMBIENTALES Sexo Más varones que mujeres cometen suicidio, pero más mujeres intentan suicidarse. Edad La tasa de suicidio tiene dos crestas: • • los jóvenes (15 - 35 años); los viejos (más de 75 años). WHO/MNH/MBD/00.4 Página 11 Estado Civil Las personas divorciadas, viudas y solteras corren mayor riesgo que las casadas. Las que viven solas o están separadas son más vulnerables. Ocupación Los médicos, veterinarios, farmaceutas, químicos y granjeros tienen tasas de suicidio por encima del promedio. Desempleo Se ha encontrado que la pérdida del trabajo, en vez del estatus de las personas desempleadas, está asociada con el suicidio. Migración Las personas que se han mudado de un área rural a una urbana o a una región o país diferente, son más vulnerables al comportamiento suicida. Factores medioambien",2000 OMS Manual suicidio  atencion primaria.pdf,¿Qué se ha encontrado asociado con el suicidio?,"La pérdida de trabajo, en lugar de la situación de las personas desempleadas",lmqg/t5-base-squad-qag,349
350,"Los efectos del desempleo están probablemente mediados por factores tales como la pobreza, las privaciones sociales, las dificultades domésticas y la desesperanza. Por otro lado, es más probable que las personas con trastornos mentales carezcan de empleo que las personas con buena salud mental. A nivel de cualquier tasa se debe considerar la diferencia entre lo que significa haber perdido el empleo recientemente y estar desempleado desde hace tiempos: un mayor riesgo se asocia con el primero. Residencia rural/urbana En algunos países los suicidios son más frecuentes en áreas urbanas, mientras en otros ocurren con más frecuencia en áreas rurales. Migración La migración – con sus problemas anexos de pobreza, vivienda deficiente, falta de apoyo social y expectativas insatisfechas – aumenta el riesgo de suicidio. Otros Ciertos factores sociales, tales como la pronta disponibilidad de medios para cometer suicidio y los acontecimientos estresantes juegan un papel significativo en el aumento ",2000 OMS PARA MEDICOS GENRALISTAS PREVENCION DEL SUICIDIO.pdf,¿Dónde ocurren los suicidios con más frecuencia?,Zonas rurales,lmqg/t5-base-squad-qag,350
351,"Existen varias escalas para valorar el riesgo de suicidio a través de encuestas, pero son menos útiles que una buena entrevista clínica para identificar la persona que está en inminente riesgo de cometer suicidio. WHO/MNH/MBD/00.1 Página 14 El médico puede verse enfrentado a una variedad de condiciones y situaciones asociadas con comportamientos suicidas. Un varón de edad, recientemente viudo, tratado por depresión, que vive solo, con una historia de intento de suicidio, y una dama joven con unos pocos rasguños en el antebrazo, a quien su novio acaba de dejar, son dos ejemplos contrastantes. En realidad, la mayoría de los pacientes caen entre estos dos extremos y pueden fluctuar de una categoría a otra. Cuando los médicos poseen un indicio razonable de que el paciente podría ser suicida, enfrentan el dilema de cómo proceder. Algunos médicos se sienten incómodos con estos pacientes. Es importante para ellos tomar conciencia de ese sentimiento y buscar ayuda de colegas, y posiblemente pr",2000 OMS PARA MEDICOS GENRALISTAS PREVENCION DEL SUICIDIO.pdf,¿Cuáles son dos ejemplos de condiciones y situaciones asociadas con comportamientos suicidas?,"Un hombre mayor, recientemente viudo, tratado por la depresión, que vive solo, con un historial de intento de suicidio, y una joven con algunos arañazos en el antebrazo, a quien su novio acaba de dejar",lmqg/t5-base-squad-qag,351
352,"Estudios recientes han mostrado que después de un derrame – particularmente en presencia de lesiones posteriores, las cuales causan mayor inhabilidad y deterioro físico – 19% de los pacientes se deprimen y presentan tendencias suicidas. Neoplasmas El riesgo de suicidio es más alto al momento del diagnóstico y en los primeros dos años de la enfermedad terminal, con un aumento del riesgo en los casos de malignidad progresiva. El dolor es un factor que contribuye significativamente al suicidio. VIH/SIDA La infección por VIH y el SIDA representan un riesgo aumentado de suicidio en los jóvenes, con altas tasas de suicidio. El riesgo es mayor al momento de la confirmación del diagnóstico y en las etapas tempranas de la enfermedad. Los usuarios de drogas intravenosas están en mayor riesgo aún. Otras condiciones Otras condiciones médicas crónicas tales como enfermedades renales, hepáticas, óseas y articulares, cardiovasculares y trastornos gastrointestinales están implicadas en el suicidio. La",2000 OMS PARA MEDICOS GENRALISTAS PREVENCION DEL SUICIDIO.pdf,¿Cuáles son otras afecciones médicas crónicas involucradas en el suicidio?,"Enfermedades renales, hepáticas, óseas y articulares, trastornos cardiovasculares y gastrointestinales",lmqg/t5-base-squad-qag,352
353,"La adolescencia es un estado normal y durante su curso son comunes algunos rasgos tales como baja autoestima, pesimismo, problemas de concentración, fatiga, y problemas con el sueño. Son rasgos comunes con la depresión como enfermedad, pero no son causa de alarma hasta que aparezcan como persistentes y progresivos. Comparado con los adultos deprimidos, el joven tiende a actuar más, (en el sentido de expresar conductas), comer (en lugar de pedir ayuda) y dormir más (como forma de eludir o evadir). Los pensamientos depresivos pueden presentarse normalmente en la adolescencia y reflejar el proceso normal de desarrollo, siendo el momento en el que los jóvenes se preocupan por cuestiones existenciales. La intensidad de los pensamientos suicidas, su profundidad y duración, el contexto en el cual surgen, la imposibilidad de distraer a un niño o joven de estos pensamientos (por ejemplo su persistencia) son los rasgos que distinguen a un joven saludable de uno que se encuentra al margen de una ",2001 OMS La prevencion en la escuela .pdf,¿Cuáles son los rasgos que distinguen a un joven sano de uno que está al margen de un estado normal y durante su curso son comunes?,"La intensidad de los pensamientos suicidas, su profundidad y duración, el contexto en el que surgen, el contexto en el que surgen, la imposibilidad de distraer a un niño o joven de estos pensamientos (por ejemplo, su persistencia)",lmqg/t5-base-squad-qag,353
354," Página 12 • Condiciones de trabajo deficientes y factores de estrés físicos (ruido, iluminación deficiente, falta de espacio, temperaturas extremas, ergonomía deficiente, peligros químicos, falta de acceso a programas de salud para el empleado); Tareas monótonas o repetitivas o sub-utilización de habilidades; • • Bajo salario que conduce a sobre tiempo y trabajo a destajo; • Culturas organizacionales que promueven el estigma y la discriminación hacia las personas con problemas de salud mental. Adicionalmente, ciertas ocupaciones son intrínsecamente más estresantes, por ejemplo, aquellas donde los trabajadores participan en altos niveles de contacto interpersonal con el público, los policías u otros trabajadores que velan por el mantenimiento del orden público si están expuestos a eventos traumáticos o violentos, los trabajadores en cadenas de fabricación involucrados en tareas repetitivas, los controladores de tráfico aéreo y los trabajadores de la salud.13,15 Las mujeres son particul",2006 OMS GUIA AMBITO LABORAL.pdf,¿Cuáles son algunas ocupaciones que son intrínsecamente más estresantes?,"Aquellos en los que los trabajadores participan en altos niveles de contacto interpersonal con el público, la policía u otros trabajadores que velan por el mantenimiento del orden público si están expuestos a acontecimientos traumáticos o violentos",lmqg/t5-base-squad-qag,354
355," Página 22 CÓMO PUEDE UN DIRECTOR AYUDAR A UN TRABAJADOR SUICIDA No hay reglas fijas que se puedan seguir para reconocer cuándo un trabajador puede ser suicida. Las personas que se sienten suicidas generalmente se sienten deprimidas, agotadas y pueden decir que no saben qué hacer. Sin embargo, las personas varían en la medida en que están dispuestas a revelar sus problemas a otros, particularmente los directores y colegas de trabajo. No obstante, la mayoría de aquellos que eventualmente se suicidan sí proporcionan señales definitivas de advertencia en relación con sus intenciones suicidas en las semanas o meses anteriores a su muerte. Estos no son llamados inofensivos de atención, sino importantes súplicas de ayuda que se deben considerar seriamente. Las señales de advertencia incluyen:26,27 • Haberse aislado y no poder relacionarse con amigos y compañe- ros de trabajo; • Hablar acerca de sentirse aislado y solitario; • Expresar sentimientos de fracaso, inutilidad, falta de esperanza o",2006 OMS GUIA AMBITO LABORAL.pdf,¿Cuáles son las señales de advertencia?,"Expresar sentimientos de fracaso, futilidad, falta de esperanza o falta de ayuda",lmqg/t5-base-squad-qag,355
356,"Conversar con colegas y supervisores, aceptar que el suicidio es un posible resultado de la orientación, hacer una “autopsia psicológica” y asistir al funeral han sido reconocidos como importantes estrategias para los consejeros que se enfrentan al Página.20 Página.1 está adecuadamente capacitado, el personal de la escuela puede detectar factores de riesgo de suicidio entre los estudiantes. Cuando el comportamiento suicida ocurre en un ambiente escolar, es importante comunicarse con los padres, asegurar que al estudiante se le ha hecho la evaluación y se le ha dado el apoyo adecuados antes de volver a la escuela y que, a su regreso, sea recibido de manera positiva. Los estudiantes que han enfrentado el suicidio de otro estudiante necesitan hablar al respecto e intentar entender lo que ha ocurrido. Los grupos de apoyo para situaciones de pesar en la escuela pueden ser útiles para ayudar a los estudiantes a sobrellevar la pérdida de un compañero o amigo debido al suicidio. Este proceso p",2006 oms guia para consejeros.pdf,¿Qué es importante comunicarse con los padres cuando un estudiante se enfrenta al suicidio en un ambiente escolar?,"Asegurarse de que el estudiante ha sido evaluado y recibido un apoyo adecuado antes de regresar a la escuela y de que, a su regreso, se le recibe de manera positiva",lmqg/t5-base-squad-qag,356
357,"El análisis posteriormente guía el juicio médico, la intervención de orientación, la prevención y la intervención posterior. Todas las valoraciones de suicidio deben contener lo siguiente: • • • • • • • • Revisión de los factores de riesgo relevantes; Historial completo de comportamiento suicida; Condiciones biológicas, psicosociales, mentales, situacionales o médicas que no se pueden cambiar; Medida de los síntomas suicidas actuales, con indicación de grado de desesperanza; Estresores precipitantes; Nivel de impulsividad y control personal; Otros datos atenuantes; Factores protectores.",2006 oms guia para consejeros.pdf,¿Qué debe incluirse en todas las evaluaciones de suicidios?,"Medición de los síntomas suicidas actuales, con indicación de grado de desesperanza",lmqg/t5-base-squad-qag,357
358,"Identificar los factores de riesgo asociados con el comportamiento suicida es fundamental para la toma de decisiones clínicas del consejero. El conocimiento de dichos factores de riesgo puede orientar la prevención y la intervención ayudando a los consejeros a identificar a las personas en situación de mayor riesgo. Por consiguiente, la capacitación de los consejeros en el análisis de riesgos es fundamental para la reducción de los suicidios. A pesar de que no hay un “estilo global” de comunicación de intenciones suicidas, entre las señales de advertencia de comportamiento suicida se encuentran las siguientes: falta de interés por el bienestar personal; cambios en los patrones sociales, disminución de la productividad laboral o el rendimiento académico; alteraciones en los patrones de sueño y alimenticios; intentos de poner asuntos personales en orden o hacer las paces con los demás; interés atípico en el estado de ánimo de los demás; preocupación por temas de muerte y violencia; mejor",2006 oms guia para consejeros.pdf,¿Cuáles son algunas señales de advertencia de comportamiento suicida?,Intentos de poner los asuntos personales en orden o hacer las paces con los demás,lmqg/t5-base-squad-qag,358
359,"4 Este documento está dirigido a los administradores de correccionales que tienen la responsabilidad de desarrollar o implementar programas de salud mental en escenarios penitenciarios, y, más directamente, a funcionarios de penitenciarías y personas que proveen asistencia que tienen la responsabilidad de la seguridad y custodia de los reclusos suicidas. Proporciona algunos antecedentes generales sobre el suicidio e identifica una serie de componentes claves que se pueden usar como parte de un programa integral de prevención del suicidio para reducir el suicidio en los escenarios penitenciarios. El suicidio en la comunidad es un serio problema de salud. La Organización Mundial de la Salud estima que un intento suicida ocurre aproximadamente cada tres segundos, y un suicidio completo ocurre aproximadamente cada minuto. Esto significa que más personas mueren a causa del suicidio que a causa de conflictos armados. Por consiguiente, la reducción del suicidio se ha convertido en una importa",2007 OMS_PREVENCIÓNSUICIDIO_CARCELES.pdf,¿Cuántas personas mueren por suicidio que por conflicto armado?,Más personas mueren por suicidio que por conflictos armados,lmqg/t5-base-squad-qag,359
360,"SUICIDOLOGÍA Por último, cabe destacar los aportes de la suicidología, disciplina que surge en la década del ’70 en Estados Unidos, y que hace referencia a los comportamientos, pensamientos y sentimientos autodestructivos. Sus principales referentes son los autores Shneidman y Farberow (1969). La Asociación Argentina de prevención del suicidio (APPS) ha definido a la suicidología como “la articulación de la interdisciplinaria cuyo objeto es dar cuenta de los factores biológicos, psicológicos, éticos, sociales y culturales que van construyendo la disposición suicida en sus diferentes estados” (Martínez, 1997, pp. 17). Así es que desde la perspectiva suicidológica se tienen en cuenta no sólo los factores de riesgo del individuo propiamente dicho sino que también, se contemplan los factores de riesgo presentes en el medio familiar y socio-ambiental. IV. CONCLUSIÓN A modo de conclusión, se han podido observar a lo largo de este breve recorrido sobre el estudio del suicidio, las diferentes ","2009 Aranguren, Maria. Modelos teóricos de comprensión del suicidio.pdf",¿Qué se tiene en cuenta desde la perspectiva del suicidio?,"Los factores de riesgo del individuo propiamente dicho, pero también los factores de riesgo presentes en el entorno familiar y socioambiental",lmqg/t5-base-squad-qag,360
361,"Durkheim - Concepción sociológica En el año 1897 es publicado uno de los primeros estudios acerca del suicidio desde una perspectiva sociológica y un método previamente establecido. Durkheim postula como hipótesis de su estudio que el conjunto de suicidios cometidos en una sociedad en un determinado período de tiempo constituye en sí mismo un hecho nuevo, distinto de cada suicidio individual, y la naturaleza de ese hecho es eminentemente social; por otro lado, reconoce que las causas de los suicidios están antes fuera que dentro de cada uno de nosotros. 24 El estudio llevado a cabo por Durkheim se encuentra dividido principalmente en dos ejes: por un lado, aquellos factores extrasociales que podrían influir en el suicidio; por el otro, las causas sociales y tipos sociales propiamente dichas. Entre los factores extrasociales se encuentran: los estados psicopáticos, los estados psicológicos normales -raza y herencia-, los factores cósmicos -influencia climática y temperatura- y la imitac","2009 Aranguren, Maria. Modelos teóricos de comprensión del suicidio.pdf",¿Cuáles son los factores extrasociales que podrían influir en el suicidio?,"Estados psicopáticos, estados psicológicos normales -raza y herencia-, factores cósmicos -influencia climática y temperatura- e imitación",lmqg/t5-base-squad-qag,361
362,"Durante los últimos cincuenta años, las tasas de suicidio a escala mundial han aumentado en 60% Por cada suicidio que ocurre, hay 10 a 20 ó más intentos de suicidio. El suicidio es el resultado de un complejo intercambio de factores, de los cuales, los principales son los siguientes: Enfermedad mental A escala mundial, muchas de las personas (65-95%) que se suicidan padecen de un trastorno mental. En efecto, el riesgo de suicidio es hasta 15 veces más alto en personas que padecen de un trastorno mental en comparación con aquellas que no lo padecen. Aunque los trastornos mentales también son considerados un factor de riesgo en los países asiáticos, existe evidencia de que no son tan frecuentes en las conductas suicidas y que la impulsividad juega un papel más importante. El alto riesgo de suicidio está especialmente asociado con episodios agudos de enfermedad, reciente salida del hospital (casi la mitad de las personas se suicidan antes de su primera cita de seguimiento) o contacto reci",2009 OMS Suicidio y sevicios de emergencias.pdf,¿Cuál es el riesgo alto de suicidio asociado?,"Episodios agudos de enfermedad, alta reciente del hospital (casi la mitad de las personas se suicidan antes de su primera cita de seguimiento) o contacto repetido",lmqg/t5-base-squad-qag,362
363,"Cada vez más se le pide a la policía que evite la penalización innecesaria de los enfermos mentales a través de su participación en los programas de referencia. La meta principal de los programas de referencia para los policías es evitar los arrestos haciendo referencias directas a los programas de salud mental comunitaria. El éxito de los programas de referencia recae en los servicios integrados de salud mental que están disponibles para apoyar a la policía. Esto significa que se deben establecer relaciones estrechas de trabajo entre la policía y las organizaciones de salud mental (15). En algunas comunidades, los sitios de respuesta especializada a las crisis han eliminado muchas de las barreras que enfrenta la policía cuando refiere delincuentes mentalmente trastornados para evaluación psiquiátrica (16). WHO/MNH/MBD/00.9 Página 16 AYUDAR A ALGUIEN QUE ES SUICIDA Las personas que se sienten suicidas a menudo expresan desesperanza y depresión. Estas personas ven el suicidio como la ún",2009 OMS Suicidio y sevicios de emergencias.pdf,¿Qué expresan a menudo las personas que se sienten suicidas?,Desesperanza y depresión,lmqg/t5-base-squad-qag,363
